<?xml version="1.0" encoding="UTF-8"?>
<!-- <!DOCTYPE musicWebsite SYSTEM "musicWebsite.dtd"> -->
 <?xml-stylesheet href="musicWebsite.xsl" type="text/xsl"?>
<musicWebsite xmlns:xsi="http://www.w3.org/2001/XMLSchema-instance"
xmlns="http://www.example.com/musicWebsite" xsi:schemaLocation="http://www.example.com/musicWebsite musicWebsite.xsd">
    <artist>
        <name>Chloy Cossta</name>
        <genre>Pop</genre>
        <bio>Chloy Costa is a pop artist known for her soulful music.</bio>
    </artist>

    <albums>
        <album>
            <title>First Album</title>
            <releaseDate>2022-01-01</releaseDate>
            <tracks>
                <track>
                    <title>Track One</title>
                    <duration>3:45</duration>
                </track>
                <track>
                    <title>Track Two</title>
                    <duration>4:20</duration>
                </track>
            </tracks>
        </album>
    </albums>

    <shows>
        <show>
            <location>New York City</location>
            <date>2024-08-10</date>
        </show>
        <show>
            <location>Bangalore</location>
            <date>2024-09-05</date>
        </show>
        <show>
            <location>Delhi</location>
            <date>2024-10-15</date>
        </show>
    </shows>

    <merchandise>
        <item>
            <name>Electric Guitar T-Shirt</name>
            <price>250.00</price>
            <description>This exclusive black t-shirt features a stylish guitar design, perfect for any music enthusiast.</description>
        </item>

        <item>
            <name>Acoustic Guitar T-shirt</name>
            <price>200.00</price>
            <description>A comfortable white t-shirt adorned with a classic guitar print, a must-have for casual wear.</description>
        </item>

        <item>
            <name>Classical Acoutic guitar collection</name>
            <price>16000</price>
            <description>Beautifully crafted acoustic guitars, available in various models to suit all your musical needs.</description>
        </item>
    </merchandise>

</musicWebsite>
